date_found,source_platform,source_url,card_name,card_type,company_name,company_website,app_store_link,play_store_link,parent_company,issuing_bank,ceo_or_founders,contact_email,physical_address,phone_number,terms_conditions_url,privacy_policy_url,notes
2026-02-17,App Store,https://apps.apple.com/bo/app/cheapest-visa-cards-bitsika/id1478570397,Cheapest Visa,Credit/Virtual,,https://apps.apple.com,https://apps.apple.com/us/iphone/today,,,,,,,,https://www.apple.com/legal/internet-services/,https://www.apple.com/legal/privacy/data/en/app-store/,"It's perfect for users who want a no-KYC virtual credit card experience; fast, private, and hassle-free. Spend globally without delays or paperwork. Made for ..."
2026-02-17,Web (https://www.cointracker.io › blog › can-i-buy-crypto-wit...),https://www.cointracker.io/blog/can-i-buy-crypto-with-a-credit-card,Crypto on credit,Credit,,https://www.cointracker.io,,,,,,,,,,,"As to whether card issuers like American Express, Visa, and Mastercard allow crypto ... Can you buy crypto with a credit card with no verification ... | Could not fetch website"
2026-02-17,Web (https://www.cloaked.com › post › privacy-com-alternati...),https://www.cloaked.com/post/privacy-com-alternatives,Cloaked Pay,Virtual,"Cloaked, Inc.",https://www.cloaked.com,https://apps.apple.com/us/app/cloaked/id1600487147,https://play.google.com/store/apps/details?id=app.android.cloaked&amp;hl=en&amp;gl=US,,,Arjun Bhatnagar (Co-founder Chief Executive Officer); Abhijay Bhatnagar (Co-founder Chief Product Officer),,,,https://www.cloaked.com/terms-of-service,https://www.cloaked.com/features/all-features,Privacy.com Alternatives · 1. Cloaked · 2. Revolut · 3. Capital One Virtual Cards · 4. IronVest · 5. American Express Virtual Cards · 6. Wise Visa ...
2026-02-17,Web (https://www.visa.com.ng › payment-technology › visa-s...),https://www.visa.com.ng/run-your-business/small-business-tools/payment-technology/visa-secure.html,Visa contactless chip card,Debit and Credit,Visa,https://www.visa.com.ng,,,,,,,,,,,"Visa Secure is Visa's global EMV 3-D Secure program that makes authentication simple, lowers friction for consumers and helps prevent card-not-present fraud."
2026-02-17,Reddit r/defi,https://www.reddit.com/r/defi/comments/1r0trf2/suggest_some_nonkyc_crypto_cards/,Suggest some non,Unknown,,https://www.reddit.com/r/defi/comments/1r0trf2/suggest_some_nonkyc_crypto_cards/,,,,,,,,,,,"Realistically fully non-KYC crypto cards are rare. Most legit Visa/Mastercard partners require at least some identity verification. That said, ... | Could not fetch website"
2026-02-17,Google Play,https://play.google.com/store/apps/details?id=com.oobit&hl=en_CA,Oobit,Unknown,Google LLC,https://play.google.com,,https://play.google.com/store/apps/details?id\u003dcom.jxhy.official\u0026rdid\u003dcom.jxhy.official\u0026feature\u003dmd\u0026offerId,,,,,"1600 Amphitheatre Parkway, Mountain View, California 94043, USA",,https://myaccount.google.com/termsofservice,https://policies.google.com/privacy,"Simply tap your phone at any Visa or Mastercard POS terminal and pay directly from your crypto wallet. This functionality brings unparalleled convenience, ..."
2026-02-17,Web (https://www.visa.es › dam › unitedkingdom › PDF),https://www.visa.es/content/dam/VCOM/regional/ve/unitedkingdom/PDF/sca/Visa-PSD2-SCA-for-Remote-Electronic-Transactions-Implementation-Guide.pdf,Visa,Prepaid,Visa,https://www.visa.es,,,,,,,,,,,these can include non-reloadable prepaid cards on which no KYC has been done and thus ... • Terms and conditions specifying how the final amount ...
