date_found,source_platform,source_url,card_name,card_type,company_name,company_website,app_store_link,play_store_link,parent_company,issuing_bank,ceo_or_founders,contact_email,physical_address,phone_number,terms_conditions_url,privacy_policy_url,notes
2026-02-13,Web (https://majority.com › visa-debit-card › no-ssn),https://majority.com/en/visa-debit-card/no-ssn?srsltid=AfmBOor75ZmdqSiGFPYWMMFn_fT2ceBTFoSo9X9u0LyNXgVlt4K_x3ry,Debit,Debit,,https://majority.com,,,,,,,,,,,"Get a free MAJORITY Visa Debit Card whether or not you have an SSN and save with cashback, discounts, no hidden fees, and more. | Could not fetch website"
2026-02-13,Web (https://usa.visa.com › pay-with-visa › checkout-faq),https://usa.visa.com/pay-with-visa/checkout-faq.html,Visa Prepaid,Prepaid,Visa,https://usa.visa.com,,,,,,,,,,,I'm not able to sign in or verify my identity and pay with my Visa card.
2026-02-13,Web (https://yellow.com › News),https://yellow.com/news/former-apple-engineer-creates-stablecoin-visa-card-that-hides-blockchain-transactions,Former Apple Engineer Creates Stablecoin Visa,Unknown,Yellow.com,https://yellow.com,,,,,,,,,https://yellow.com/terms_of_service,https://yellow.com/learn/monero-vs-zcash-which-crypto-is-better-for-your-privacy-in-2025,The card combines regulatory compliance with privacy ...
2026-02-13,Google Play,https://play.google.com/store/apps/details?id=com.ownrwallet.wallet&gl=it&hl=it,Visa,Unknown,Google LLC,https://play.google.com,,https://play.google.com/store/apps/details?id\u003dcom.jxhy.official\u0026rdid\u003dcom.jxhy.official\u0026feature\u003dmd\u0026offerId,,,,,"1600 Amphitheatre Parkway, Mountain View, California 94043, USA",,https://myaccount.google.com/termsofservice,https://policies.google.com/privacy,"... no KYC verification, instant email delivery. More info at giftcards.ownrwallet.com. Manage all crypto and Visa card in a single app, swiftly and simply. Top ..."
2026-02-13,Web (https://www.cryptopolitan.com › best-crypto-to-buy-the...),https://www.cryptopolitan.com/best-crypto-to-buy-the-non-kyc-visa-card-thats-faster-than-138-solana/,KYC Visa,Unknown,,https://www.cryptopolitan.com,,,,,,,,,,,"MEXC has highlighted this angle directly, positioning a no-KYC Visa card ... Terms and conditions. SEARCH. | Could not fetch website"
2026-02-13,Web (https://buvei.com › blog › top-5-free-virtual-visa-card-pl...),https://buvei.com/blog/top-5-free-virtual-visa-card-platforms-with-no-deposit/,Buvei Virtual Card,Virtual,Buvei LLC,https://buvei.com,,,,,,info@buvei.com,,,https://buvei.com/terms,https://buvei.com/privacy,"Sign up today and get $5 in free card opening credit. logo ... Remember, “no deposit” doesn't mean “no verification” or “no limits."
