date_found,source_platform,source_url,card_name,card_type,company_name,company_website,app_store_link,play_store_link,parent_company,issuing_bank,ceo_or_founders,contact_email,physical_address,phone_number,terms_conditions_url,privacy_policy_url,notes
2026-06-12,Web (https://www.cryptocards.so › no-kyc-cards),https://www.cryptocards.so/en/no-kyc-cards,Crypto Cards Card,Virtual,Crypto Cards,https://www.cryptocards.so,,,,,Alena Kovarova (CEO); Emma Becker (Head of Research); Dalimil Holeček (CIO),,"11845 West Olympic Boulevard, Suite 1100 West, Los Angeles, CA 90064, United States",+1 (417) 770-6728,https://www.cryptocards.so/en/terms,https://www.cryptocards.so/en/privacy,"An entry-level virtual card for privacy-conscious users with a $25,000 annual spending limit and no KYC requirements. 0% Cashback. Virtual CardVisaNo KYC. USDT."
2026-06-12,Web (https://hambit.io › prepaid),https://hambit.io/prepaid,Hambit Card,Prepaid/Virtual,Hambit,https://hambit.io,,,,,,,,,,,"No KYC is required, and its usage is similar card for transactions: select either VISA or Mastercard as the payment network. card is a prepaid card, The ... | Could not fetch website"
2026-06-12,Web (https://www.visa.com › Home › Find Card),https://www.visa.com/en-us/card-finder/prepaid-card,Visa Card,Prepaid,Visa Inc.,https://www.visa.com,,,,,,,,,,,"Compare Visa prepaid card options designed for flexibility and control. Choose from reloadable prepaid cards that help you budget, reload, and spend easily."
2026-06-12,YouTube,https://www.youtube.com/watch?v=DhFZpVMrWyo,Google LLC Card,Unknown,Google LLC,https://www.youtube.com,,,Alphabet Inc.,,,,"901 Cherry Ave. San Bruno, CA 94066 USA",+1 650-253-0001,https://www.youtube.com/t/terms,https://www.youtube.com/t/privacy,"They also discuss Visa's recent stablecoin announcements, the potential use cases of stable-linked cards ... Visa Spotlight: The future of ..."
2026-06-12,Google Play,https://play.google.com/store/apps/details?id=com.mercipro.fyatu,Fyatu - Virtual Debit Cards,Debit/Virtual,Google LLC,https://play.google.com,,https://play.google.com/store/apps/details?id\u003dcom.miHoYo.GenshinImpact\u0026rdid\u003dcom.miHoYo.GenshinImpact\u0026feature\u003dmd\u0026offerId,,,,,"1600 Amphitheatre Parkway, Mountain View, California 94043, USA",,https://myaccount.google.com/termsofservice,https://policies.google.com/privacy,"Create virtual Visa and Mastercard debit cards in seconds, fund them from anywhere, and pay on any platform that accepts cards — no bank account ..."
2026-06-12,Google Play,https://play.google.com/store/apps/details?id=com.cardtonic.app&hl=en_ZA,Cardtonic: Virtual &amp; Gift Card,Virtual,,https://play.google.com,,https://play.google.com/store/apps/details?id\u003dcom.miHoYo.GenshinImpact\u0026rdid\u003dcom.miHoYo.GenshinImpact\u0026feature\u003dmd\u0026offerId,,,,,,,https://myaccount.google.com/termsofservice,https://policies.google.com/privacy,Cardtonic gives you instant access to one of the best and cheapest virtual dollar cards in Nigeria (Visa and Mastercard). So you can pay online without limits
2026-06-12,Web (https://guardarian.com › buy-usdc-without-verification),https://guardarian.com/buy-usdc-without-verification,Guardarian Card,Unknown,Guardarian,https://guardarian.com,,,,,,,"Na Čečeličce 425/4, Smíchov, 15000, Prague, Czech Republic",,https://guardarian.com/terms-of-service,https://guardarian.com/privacy-policy,Instantly sell USDC to fiat via bank transfer or direct payout to Visa and MasterCard with no KYC. ... Please examine the terms and conditions of the service and ...
2026-06-12,Web (https://security.stackexchange.com › questions › how-d...),https://security.stackexchange.com/questions/21168/how-does-amazon-bill-me-without-the-cvc-cvv-cvv2,Security Card,Unknown,Security,https://security.stackexchange.com,,,,,,,,,https://stackoverflow.com/legal,https://security.stackexchange.com/questions/tagged/privacy,"The card in question is a VISA, if that's of any importance. I've noticed this only on Amazon. All other sites I've purchased something from, ever, have ..."
